item_id,item_name,description,category,location,status
1303,wallet,wallet possibly left in computer lab,wallet,computer lab,lost
1304,tablet,tablet of silver color found in cafeteria,electronics,cafeteria,lost
1305,notebook,black colored notebook near auditorium,stationery,auditorium,found
1306,earbuds,lost white earbuds close to classroom,electronics,classroom,found
1307,laptop,laptop possibly left in library,electronics,library,found
1308,keys,green colored keys near parking area,accessory,parking area,lost
1309,earbuds,found earbuds with in good condition in canteen,electronics,canteen,found
1310,water bottle,water bottle possibly left in corridor,accessory,corridor,found
1311,headphones,headphones possibly left in parking area,electronics,parking area,found
1312,calculator,calculator possibly left in playground,electronics,playground,lost
1313,id card,purple id card spotted at auditorium,document,auditorium,found
1314,watch,black colored watch near library,accessory,library,lost
1315,charger,red fabric charger with logo near playground,electronics,playground,found
1316,umbrella,green leather umbrella seen around auditorium,accessory,auditorium,lost
1317,tablet,fabric tablet with logo around classroom,electronics,classroom,lost
1318,charger,charger of black color found in library,electronics,library,found
1319,handbag,green metal handbag seen around cafeteria,bag,cafeteria,lost
1320,umbrella,brown leather umbrella seen around corridor,accessory,corridor,found
1321,phone,lost white phone close to cafeteria,phone,cafeteria,found
1322,laptop,laptop of purple color found in parking area,electronics,parking area,lost
1323,id card,blue metal id card seen around parking area,document,parking area,found
1324,glasses,glasses possibly left in canteen,accessory,canteen,lost
1325,charger,lost purple charger close to canteen,electronics,canteen,lost
1326,pen drive,white metal pen drive with zipper near parking area,electronics,parking area,found
1327,pen drive,lost blue pen drive close to bus stop,electronics,bus stop,lost
1328,backpack,backpack of grey color found in auditorium,bag,auditorium,lost
1329,notebook,found notebook with in good condition in bus stop,stationery,bus stop,lost
1330,phone,phone possibly left in canteen,phone,canteen,found
1331,notebook,notebook located in corridor area,stationery,corridor,lost
1332,headphones,white rubber headphones with two pockets near canteen,electronics,canteen,found
1333,wallet,found wallet with with two pockets in canteen,wallet,canteen,lost
1334,handbag,handbag possibly left in canteen,bag,canteen,lost
1335,id card,blue colored id card near library,document,library,lost
1336,glasses,lost blue glasses close to parking area,accessory,parking area,found
1337,textbook,red plastic textbook seen around computer lab,book,computer lab,lost
1338,power bank,power bank located in library area,electronics,library,lost
1339,notebook,brown rubber notebook seen around classroom,stationery,classroom,found
1340,notebook,blue notebook spotted at computer lab,stationery,computer lab,lost
1341,charger,charger possibly left in auditorium,electronics,auditorium,found
1342,glasses,found glasses with with zipper in computer lab,accessory,computer lab,found
1343,laptop,green laptop spotted at cafeteria,electronics,cafeteria,found
1344,backpack,lost yellow backpack close to computer lab,bag,computer lab,lost
1345,id card,id card possibly left in parking area,document,parking area,found
1346,watch,found watch with slightly damaged in cafeteria,accessory,cafeteria,lost
1347,earbuds,brown colored earbuds near auditorium,electronics,auditorium,lost
1348,phone,phone possibly left in corridor,phone,corridor,found
1349,calculator,lost black calculator close to library,electronics,library,lost
1350,keys,leather keys with zipper around corridor,accessory,corridor,found
1351,wallet,wallet located in library area,wallet,library,found
1352,pen drive,found pen drive with with name written in auditorium,electronics,auditorium,lost
1353,laptop,red rubber laptop seen around classroom,electronics,classroom,lost
1354,phone,phone located in bus stop area,phone,bus stop,found
1355,keys,lost black keys close to cafeteria,accessory,cafeteria,lost
1356,headphones,found headphones with with stickers in bus stop,electronics,bus stop,lost
1357,calculator,green calculator spotted at computer lab,electronics,computer lab,found
1358,tablet,tablet of white color found in cafeteria,electronics,cafeteria,lost
1359,laptop,lost brown laptop close to playground,electronics,playground,found
1360,handbag,handbag of grey color found in library,bag,library,found
1361,calculator,found calculator with with zipper in classroom,electronics,classroom,lost
1362,phone,phone of silver color found in computer lab,phone,computer lab,lost
1363,textbook,yellow colored textbook near computer lab,book,computer lab,lost
1364,watch,rubber watch with name written around corridor,accessory,corridor,lost
1365,laptop,laptop of brown color found in parking area,electronics,parking area,found
1366,umbrella,found umbrella with with two pockets in parking area,accessory,parking area,found
1367,earbuds,red colored earbuds near bus stop,electronics,bus stop,found
1368,water bottle,water bottle of white color found in cafeteria,accessory,cafeteria,lost
1369,umbrella,lost blue umbrella close to library,accessory,library,lost
1370,laptop,rubber laptop with name written around bus stop,electronics,bus stop,found
1371,handbag,found handbag with with zipper in classroom,bag,classroom,found
1372,wallet,found wallet with slightly damaged in computer lab,wallet,computer lab,found
1373,backpack,found backpack with in good condition in corridor,bag,corridor,lost
1374,watch,brown watch spotted at corridor,accessory,corridor,lost
1375,glasses,fabric glasses with zipper around canteen,accessory,canteen,lost
1376,headphones,headphones of green color found in parking area,electronics,parking area,lost
1377,headphones,lost grey headphones close to computer lab,electronics,computer lab,lost
1378,textbook,textbook located in playground area,book,playground,found
1379,pen drive,pen drive of yellow color found in classroom,electronics,classroom,found
1380,backpack,backpack possibly left in canteen,bag,canteen,found
1381,handbag,leather handbag in good condition around bus stop,bag,bus stop,lost
1382,handbag,brown fabric handbag with scratches near parking area,bag,parking area,lost
1383,backpack,lost purple backpack close to cafeteria,bag,cafeteria,lost
1384,handbag,yellow colored handbag near canteen,bag,canteen,lost
1385,phone,rubber phone in good condition around bus stop,phone,bus stop,lost
1386,pen drive,found pen drive with with stickers in corridor,electronics,corridor,lost
1387,notebook,notebook located in canteen area,stationery,canteen,lost
1388,textbook,found textbook with slightly damaged in canteen,book,canteen,found
1389,water bottle,white water bottle spotted at auditorium,accessory,auditorium,found
1390,notebook,green plastic notebook with name written near cafeteria,stationery,cafeteria,lost
1391,glasses,glasses possibly left in parking area,accessory,parking area,lost
1392,glasses,glasses of red color found in computer lab,accessory,computer lab,found
1393,earbuds,lost yellow earbuds close to cafeteria,electronics,cafeteria,found
1394,phone,grey colored phone near classroom,phone,classroom,found
1395,umbrella,lost brown umbrella close to library,accessory,library,lost
1396,textbook,rubber textbook with name written around classroom,book,classroom,lost
1397,earbuds,red colored earbuds near canteen,electronics,canteen,lost
1398,headphones,headphones of grey color found in bus stop,electronics,bus stop,found
1399,power bank,lost black power bank close to parking area,electronics,parking area,found
1400,headphones,headphones possibly left in playground,electronics,playground,lost
1401,calculator,fabric calculator with logo around cafeteria,electronics,cafeteria,lost
1402,backpack,backpack of blue color found in parking area,bag,parking area,lost
1403,headphones,leather headphones with logo around corridor,electronics,corridor,found
1404,power bank,lost purple power bank close to classroom,electronics,classroom,lost
1405,umbrella,umbrella possibly left in cafeteria,accessory,cafeteria,found
1406,backpack,blue fabric backpack with two pockets near playground,bag,playground,lost
1407,notebook,white metal notebook with zipper near canteen,stationery,canteen,found
1408,tablet,tablet of silver color found in cafeteria,electronics,cafeteria,lost
1409,keys,white leather keys seen around bus stop,accessory,bus stop,found
1410,keys,leather keys in good condition around cafeteria,accessory,cafeteria,lost
1411,id card,lost green id card close to playground,document,playground,lost
1412,textbook,rubber textbook with name written around playground,book,playground,lost
1413,umbrella,yellow colored umbrella near library,accessory,library,lost
1414,charger,charger of yellow color found in computer lab,electronics,computer lab,found
1415,tablet,found tablet with with scratches in classroom,electronics,classroom,found
1416,calculator,rubber calculator with logo around canteen,electronics,canteen,found
1417,wallet,wallet of green color found in canteen,wallet,canteen,found
1418,handbag,purple rubber handbag slightly damaged near classroom,bag,classroom,found
1419,power bank,power bank located in corridor area,electronics,corridor,lost
1420,water bottle,plastic water bottle with logo around classroom,accessory,classroom,lost
1421,tablet,brown colored tablet near cafeteria,electronics,cafeteria,found
1422,umbrella,umbrella possibly left in cafeteria,accessory,cafeteria,lost
1423,calculator,grey metal calculator with scratches near library,electronics,library,lost
1424,water bottle,water bottle possibly left in library,accessory,library,lost
1425,power bank,power bank possibly left in classroom,electronics,classroom,found
1426,calculator,silver rubber calculator slightly damaged near canteen,electronics,canteen,lost
1427,watch,found watch with with logo in canteen,accessory,canteen,lost
1428,charger,charger possibly left in corridor,electronics,corridor,lost
1429,power bank,grey plastic power bank seen around library,electronics,library,found
1430,glasses,glasses possibly left in cafeteria,accessory,cafeteria,found
1431,laptop,plastic laptop with name written around library,electronics,library,lost
1432,calculator,found calculator with with logo in classroom,electronics,classroom,found
1433,wallet,green plastic wallet with zipper near classroom,wallet,classroom,found
1434,notebook,blue leather notebook seen around cafeteria,stationery,cafeteria,found
1435,glasses,red glasses spotted at classroom,accessory,classroom,found
1436,laptop,laptop located in cafeteria area,electronics,cafeteria,found
1437,earbuds,earbuds located in corridor area,electronics,corridor,lost
1438,id card,brown colored id card near library,document,library,lost
1439,calculator,purple plastic calculator with two pockets near parking area,electronics,parking area,lost
1440,laptop,laptop of grey color found in canteen,electronics,canteen,lost
1441,water bottle,water bottle located in library area,accessory,library,found
1442,handbag,handbag of yellow color found in bus stop,bag,bus stop,lost
1443,handbag,found handbag with with logo in bus stop,bag,bus stop,found
1444,umbrella,umbrella located in classroom area,accessory,classroom,found
1445,power bank,white leather power bank with scratches near library,electronics,library,found
1446,headphones,green colored headphones near cafeteria,electronics,cafeteria,found
1447,textbook,found textbook with with name written in computer lab,book,computer lab,lost
1448,notebook,purple colored notebook near bus stop,stationery,bus stop,lost
1449,tablet,lost blue tablet close to parking area,electronics,parking area,lost
1450,phone,blue leather phone with two pockets near corridor,phone,corridor,found
1451,power bank,black power bank spotted at computer lab,electronics,computer lab,lost
1452,umbrella,black umbrella spotted at corridor,accessory,corridor,found
1453,id card,red plastic id card in good condition near corridor,document,corridor,found
1454,earbuds,lost silver earbuds close to library,electronics,library,found
1455,textbook,black rubber textbook slightly damaged near classroom,book,classroom,lost
1456,phone,phone possibly left in corridor,phone,corridor,found
1457,power bank,blue power bank spotted at classroom,electronics,classroom,lost
1458,glasses,found glasses with in good condition in playground,accessory,playground,lost
1459,headphones,white headphones spotted at canteen,electronics,canteen,found
1460,earbuds,earbuds of green color found in parking area,electronics,parking area,lost
1461,id card,brown fabric id card slightly damaged near classroom,document,classroom,found
1462,watch,found watch with with two pockets in playground,accessory,playground,lost
1463,earbuds,found earbuds with with zipper in canteen,electronics,canteen,found
1464,laptop,laptop of silver color found in canteen,electronics,canteen,lost
1465,textbook,found textbook with with name written in auditorium,book,auditorium,found
1466,tablet,yellow metal tablet seen around cafeteria,electronics,cafeteria,found
1467,tablet,blue leather tablet seen around corridor,electronics,corridor,lost
1468,charger,charger of black color found in bus stop,electronics,bus stop,found
1469,keys,yellow keys spotted at playground,accessory,playground,lost
1470,handbag,white plastic handbag seen around classroom,bag,classroom,found
1471,notebook,notebook located in classroom area,stationery,classroom,found
1472,water bottle,blue water bottle spotted at corridor,accessory,corridor,lost
1473,calculator,green calculator spotted at parking area,electronics,parking area,found
1474,laptop,red plastic laptop seen around parking area,electronics,parking area,found
1475,textbook,green colored textbook near corridor,book,corridor,lost
1476,glasses,found glasses with with stickers in canteen,accessory,canteen,found
1477,phone,plastic phone with name written around canteen,phone,canteen,lost
1478,headphones,yellow plastic headphones in good condition near auditorium,electronics,auditorium,lost
1479,wallet,found wallet with with two pockets in cafeteria,wallet,cafeteria,lost
1480,phone,grey phone spotted at classroom,phone,classroom,lost
1481,earbuds,lost white earbuds close to auditorium,electronics,auditorium,lost
1482,textbook,plastic textbook slightly damaged around parking area,book,parking area,found
1483,watch,watch of silver color found in canteen,accessory,canteen,found
1484,tablet,tablet of silver color found in library,electronics,library,found
1485,notebook,notebook located in library area,stationery,library,found
1486,umbrella,brown umbrella spotted at parking area,accessory,parking area,found
1487,id card,id card possibly left in computer lab,document,computer lab,lost
1488,phone,purple phone spotted at parking area,phone,parking area,lost
1489,earbuds,purple leather earbuds slightly damaged near cafeteria,electronics,cafeteria,found
1490,laptop,purple laptop spotted at bus stop,electronics,bus stop,found
1491,phone,white phone spotted at canteen,phone,canteen,found
1492,pen drive,white fabric pen drive with scratches near parking area,electronics,parking area,found
1493,tablet,found tablet with with logo in classroom,electronics,classroom,found
1494,watch,watch possibly left in computer lab,accessory,computer lab,lost
1495,glasses,white colored glasses near cafeteria,accessory,cafeteria,found
1496,pen drive,lost grey pen drive close to auditorium,electronics,auditorium,found
1497,earbuds,white earbuds spotted at corridor,electronics,corridor,found
1498,water bottle,water bottle located in bus stop area,accessory,bus stop,found
1499,power bank,blue fabric power bank with scratches near parking area,electronics,parking area,lost
1500,pen drive,found pen drive with in good condition in computer lab,electronics,computer lab,lost
1501,id card,found id card with in good condition in parking area,document,parking area,found
1502,handbag,brown handbag spotted at canteen,bag,canteen,lost
1503,handbag,handbag of purple color found in cafeteria,bag,cafeteria,found
1504,handbag,brown colored handbag near bus stop,bag,bus stop,found
1505,notebook,yellow metal notebook seen around corridor,stationery,corridor,lost
1506,textbook,textbook possibly left in bus stop,book,bus stop,found
1507,notebook,found notebook with with stickers in bus stop,stationery,bus stop,lost
1508,keys,lost silver keys close to cafeteria,accessory,cafeteria,found
1509,laptop,red metal laptop seen around corridor,electronics,corridor,found
1510,textbook,textbook possibly left in canteen,book,canteen,lost
1511,notebook,notebook of silver color found in classroom,stationery,classroom,lost
1512,handbag,silver plastic handbag seen around playground,bag,playground,lost
1513,pen drive,brown pen drive spotted at parking area,electronics,parking area,lost
1514,backpack,lost white backpack close to corridor,bag,corridor,lost
1515,wallet,wallet located in bus stop area,wallet,bus stop,found
1516,water bottle,green plastic water bottle seen around auditorium,accessory,auditorium,found
1517,textbook,textbook of white color found in bus stop,book,bus stop,found
1518,phone,phone of white color found in computer lab,phone,computer lab,lost
1519,textbook,textbook of grey color found in playground,book,playground,found
1520,handbag,handbag possibly left in classroom,bag,classroom,found
1521,power bank,power bank located in classroom area,electronics,classroom,found
1522,earbuds,found earbuds with with logo in corridor,electronics,corridor,found
1523,textbook,silver textbook spotted at playground,book,playground,found
1524,textbook,textbook located in computer lab area,book,computer lab,lost
1525,charger,silver rubber charger seen around corridor,electronics,corridor,lost
1526,water bottle,lost silver water bottle close to parking area,accessory,parking area,found
1527,pen drive,pen drive possibly left in library,electronics,library,found
1528,earbuds,lost yellow earbuds close to parking area,electronics,parking area,lost
1529,headphones,headphones of green color found in auditorium,electronics,auditorium,lost
1530,wallet,wallet possibly left in bus stop,wallet,bus stop,lost
1531,power bank,power bank located in corridor area,electronics,corridor,lost
1532,headphones,found headphones with with scratches in computer lab,electronics,computer lab,lost
1533,handbag,green leather handbag seen around canteen,bag,canteen,lost
1534,backpack,backpack possibly left in cafeteria,bag,cafeteria,found
1535,pen drive,brown plastic pen drive slightly damaged near cafeteria,electronics,cafeteria,lost
1536,wallet,metal wallet with two pockets around classroom,wallet,classroom,lost
1537,handbag,green fabric handbag seen around canteen,bag,canteen,found
1538,headphones,grey fabric headphones seen around cafeteria,electronics,cafeteria,found
1539,power bank,lost purple power bank close to classroom,electronics,classroom,found
1540,phone,green colored phone near cafeteria,phone,cafeteria,lost
1541,phone,lost white phone close to classroom,phone,classroom,found
1542,id card,yellow plastic id card with two pockets near classroom,document,classroom,lost
1543,power bank,power bank located in corridor area,electronics,corridor,found
1544,watch,watch of white color found in parking area,accessory,parking area,found
1545,earbuds,silver colored earbuds near cafeteria,electronics,cafeteria,found
1546,water bottle,silver water bottle spotted at auditorium,accessory,auditorium,found
1547,power bank,lost brown power bank close to cafeteria,electronics,cafeteria,lost
1548,headphones,headphones located in parking area area,electronics,parking area,lost
1549,backpack,fabric backpack with name written around bus stop,bag,bus stop,lost
1550,earbuds,black metal earbuds seen around canteen,electronics,canteen,lost
1551,umbrella,red colored umbrella near playground,accessory,playground,found
1552,notebook,blue notebook spotted at library,stationery,library,found
1553,water bottle,lost green water bottle close to computer lab,accessory,computer lab,lost
1554,charger,charger located in bus stop area,electronics,bus stop,lost
1555,earbuds,lost silver earbuds close to playground,electronics,playground,found
1556,calculator,metal calculator with logo around canteen,electronics,canteen,found
1557,power bank,lost green power bank close to library,electronics,library,found
1558,wallet,found wallet with in good condition in corridor,wallet,corridor,lost
1559,keys,black fabric keys seen around parking area,accessory,parking area,lost
1560,watch,silver fabric watch seen around cafeteria,accessory,cafeteria,lost
1561,headphones,green colored headphones near library,electronics,library,found
1562,id card,silver colored id card near bus stop,document,bus stop,lost
1563,textbook,textbook of yellow color found in classroom,book,classroom,lost
1564,id card,grey colored id card near playground,document,playground,found
1565,power bank,yellow plastic power bank with logo near cafeteria,electronics,cafeteria,lost
1566,umbrella,umbrella located in classroom area,accessory,classroom,lost
1567,power bank,green fabric power bank with name written near auditorium,electronics,auditorium,lost
1568,water bottle,water bottle possibly left in corridor,accessory,corridor,lost
1569,calculator,calculator located in playground area,electronics,playground,found
1570,watch,watch of purple color found in bus stop,accessory,bus stop,lost
1571,umbrella,fabric umbrella with name written around cafeteria,accessory,cafeteria,lost
1572,backpack,found backpack with slightly damaged in library,bag,library,found
1573,laptop,lost blue laptop close to bus stop,electronics,bus stop,lost
1574,id card,purple colored id card near classroom,document,classroom,found
1575,earbuds,found earbuds with with logo in parking area,electronics,parking area,lost
1576,notebook,notebook of black color found in corridor,stationery,corridor,lost
1577,backpack,metal backpack with stickers around parking area,bag,parking area,lost
1578,charger,rubber charger with name written around cafeteria,electronics,cafeteria,lost
1579,pen drive,yellow colored pen drive near classroom,electronics,classroom,lost
1580,textbook,textbook possibly left in computer lab,book,computer lab,found
1581,textbook,lost black textbook close to bus stop,book,bus stop,found
1582,power bank,found power bank with slightly damaged in playground,electronics,playground,found
1583,laptop,silver colored laptop near bus stop,electronics,bus stop,found
1584,keys,white plastic keys seen around bus stop,accessory,bus stop,found
1585,charger,purple metal charger seen around bus stop,electronics,bus stop,lost
1586,charger,charger possibly left in cafeteria,electronics,cafeteria,lost
1587,keys,fabric keys with name written around corridor,accessory,corridor,found
1588,headphones,silver plastic headphones seen around canteen,electronics,canteen,lost
1589,id card,white colored id card near computer lab,document,computer lab,found
1590,phone,phone located in cafeteria area,phone,cafeteria,lost
1591,backpack,fabric backpack slightly damaged around corridor,bag,corridor,lost
1592,handbag,fabric handbag with name written around canteen,bag,canteen,lost
1593,power bank,blue leather power bank seen around auditorium,electronics,auditorium,found
1594,pen drive,blue rubber pen drive seen around classroom,electronics,classroom,found
1595,glasses,glasses possibly left in playground,accessory,playground,lost
1596,notebook,plastic notebook with two pockets around library,stationery,library,found
1597,water bottle,water bottle of grey color found in classroom,accessory,classroom,found
1598,headphones,lost brown headphones close to auditorium,electronics,auditorium,found
1599,wallet,brown rubber wallet slightly damaged near auditorium,wallet,auditorium,found
1600,notebook,white plastic notebook seen around library,stationery,library,found
1601,charger,found charger with with scratches in canteen,electronics,canteen,lost
1602,charger,plastic charger with zipper around cafeteria,electronics,cafeteria,lost
1603,glasses,white glasses spotted at playground,accessory,playground,found
1604,id card,id card possibly left in library,document,library,lost
1605,power bank,found power bank with with name written in classroom,electronics,classroom,found
1606,charger,charger of silver color found in bus stop,electronics,bus stop,lost
1607,power bank,power bank of brown color found in bus stop,electronics,bus stop,lost
1608,handbag,grey handbag spotted at playground,bag,playground,lost
1609,umbrella,silver leather umbrella seen around bus stop,accessory,bus stop,lost
1610,headphones,black plastic headphones seen around canteen,electronics,canteen,lost
1611,tablet,black colored tablet near auditorium,electronics,auditorium,found
1612,headphones,found headphones with in good condition in auditorium,electronics,auditorium,found
1613,laptop,purple colored laptop near playground,electronics,playground,found
1614,textbook,textbook of green color found in library,book,library,lost
1615,id card,leather id card with zipper around computer lab,document,computer lab,found
1616,backpack,lost white backpack close to cafeteria,bag,cafeteria,lost
1617,laptop,found laptop with with two pockets in computer lab,electronics,computer lab,found
1618,glasses,glasses possibly left in classroom,accessory,classroom,lost
1619,headphones,headphones of red color found in auditorium,electronics,auditorium,lost
1620,wallet,black colored wallet near auditorium,wallet,auditorium,lost
1621,watch,grey plastic watch seen around library,accessory,library,found
1622,glasses,glasses possibly left in playground,accessory,playground,found
1623,laptop,found laptop with with logo in corridor,electronics,corridor,lost
