item_id,item_name,description,category,location,status
1,id card,black leather id card seen around corridor,document,corridor,found
2,headphones,lost grey headphones close to parking area,electronics,parking area,lost
3,umbrella,umbrella of red color found in bus stop,accessory,bus stop,lost
4,pen drive,green metal pen drive seen around auditorium,electronics,auditorium,found
5,glasses,white metal glasses seen around bus stop,accessory,bus stop,lost
6,watch,watch possibly left in corridor,accessory,corridor,found
7,charger,green charger spotted at library,electronics,library,lost
8,charger,brown colored charger near parking area,electronics,parking area,found
9,headphones,lost yellow headphones close to computer lab,electronics,computer lab,lost
10,backpack,backpack located in parking area area,bag,parking area,found
11,pen drive,lost white pen drive close to auditorium,electronics,auditorium,lost
12,notebook,white notebook spotted at library,stationery,library,lost
13,wallet,wallet of brown color found in playground,wallet,playground,lost
14,earbuds,red earbuds spotted at corridor,electronics,corridor,found
15,backpack,purple fabric backpack with logo near classroom,bag,classroom,lost
16,backpack,backpack of brown color found in library,bag,library,lost
17,umbrella,brown umbrella spotted at classroom,accessory,classroom,lost
18,calculator,found calculator with slightly damaged in cafeteria,electronics,cafeteria,found
19,power bank,power bank possibly left in playground,electronics,playground,found
20,calculator,grey colored calculator near auditorium,electronics,auditorium,found
21,charger,rubber charger with zipper around corridor,electronics,corridor,lost
22,keys,yellow plastic keys with scratches near canteen,accessory,canteen,found
23,textbook,metal textbook slightly damaged around computer lab,book,computer lab,found
24,handbag,found handbag with with zipper in bus stop,bag,bus stop,found
25,laptop,green rubber laptop seen around parking area,electronics,parking area,lost
26,watch,purple fabric watch slightly damaged near computer lab,accessory,computer lab,lost
27,watch,watch possibly left in canteen,accessory,canteen,found
28,pen drive,yellow colored pen drive near corridor,electronics,corridor,lost
29,pen drive,silver colored pen drive near library,electronics,library,lost
30,power bank,blue colored power bank near canteen,electronics,canteen,found
31,tablet,purple rubber tablet seen around library,electronics,library,lost
32,glasses,lost white glasses close to library,accessory,library,found
33,watch,plastic watch with name written around library,accessory,library,lost
34,phone,phone located in playground area,phone,playground,lost
35,backpack,red fabric backpack seen around cafeteria,bag,cafeteria,found
36,notebook,notebook of brown color found in playground,stationery,playground,found
37,glasses,glasses possibly left in auditorium,accessory,auditorium,found
38,textbook,silver textbook spotted at canteen,book,canteen,found
39,headphones,headphones located in canteen area,electronics,canteen,lost
40,notebook,notebook possibly left in classroom,stationery,classroom,found
41,laptop,plastic laptop with name written around computer lab,electronics,computer lab,lost
42,watch,watch located in classroom area,accessory,classroom,lost
43,id card,found id card with with stickers in classroom,document,classroom,found
44,keys,keys of yellow color found in bus stop,accessory,bus stop,found
45,pen drive,fabric pen drive slightly damaged around bus stop,electronics,bus stop,lost
46,laptop,found laptop with with name written in bus stop,electronics,bus stop,found
47,id card,id card of grey color found in library,document,library,lost
48,backpack,backpack located in library area,bag,library,found
49,phone,purple leather phone seen around cafeteria,phone,cafeteria,found
50,umbrella,red umbrella spotted at canteen,accessory,canteen,lost
51,handbag,blue colored handbag near canteen,bag,canteen,found
52,phone,found phone with slightly damaged in computer lab,phone,computer lab,found
53,water bottle,lost red water bottle close to classroom,accessory,classroom,lost
54,laptop,white fabric laptop with scratches near corridor,electronics,corridor,found
55,earbuds,lost blue earbuds close to parking area,electronics,parking area,lost
56,wallet,red fabric wallet with stickers near library,wallet,library,lost
57,laptop,brown rubber laptop slightly damaged near classroom,electronics,classroom,found
58,umbrella,umbrella possibly left in classroom,accessory,classroom,found
59,notebook,leather notebook with two pockets around computer lab,stationery,computer lab,found
60,wallet,wallet located in computer lab area,wallet,computer lab,lost
61,laptop,blue laptop spotted at library,electronics,library,lost
62,pen drive,blue plastic pen drive with scratches near parking area,electronics,parking area,lost
63,watch,found watch with with zipper in parking area,accessory,parking area,found
64,calculator,found calculator with in good condition in auditorium,electronics,auditorium,found
65,keys,lost purple keys close to library,accessory,library,found
66,phone,phone of silver color found in bus stop,phone,bus stop,lost
67,laptop,black metal laptop seen around classroom,electronics,classroom,found
68,charger,plastic charger in good condition around cafeteria,electronics,cafeteria,found
69,keys,found keys with with logo in canteen,accessory,canteen,found
70,calculator,silver calculator spotted at playground,electronics,playground,lost
71,wallet,metal wallet with stickers around classroom,wallet,classroom,lost
72,earbuds,silver metal earbuds seen around playground,electronics,playground,found
73,charger,blue charger spotted at computer lab,electronics,computer lab,lost
74,backpack,green plastic backpack seen around canteen,bag,canteen,lost
75,watch,found watch with in good condition in cafeteria,accessory,cafeteria,found
76,charger,white colored charger near playground,electronics,playground,found
77,wallet,white wallet spotted at bus stop,wallet,bus stop,lost
78,tablet,found tablet with in good condition in playground,electronics,playground,lost
79,pen drive,found pen drive with with logo in bus stop,electronics,bus stop,found
80,watch,watch of black color found in classroom,accessory,classroom,found
81,charger,charger possibly left in library,electronics,library,found
82,handbag,red handbag spotted at computer lab,bag,computer lab,lost
83,headphones,red colored headphones near auditorium,electronics,auditorium,lost
84,keys,purple keys spotted at parking area,accessory,parking area,lost
85,tablet,brown tablet spotted at playground,electronics,playground,found
86,water bottle,yellow water bottle spotted at canteen,accessory,canteen,found
87,charger,red charger spotted at parking area,electronics,parking area,found
88,watch,lost brown watch close to computer lab,accessory,computer lab,lost
89,phone,yellow phone spotted at corridor,phone,corridor,lost
90,earbuds,yellow leather earbuds with zipper near computer lab,electronics,computer lab,lost
91,glasses,glasses possibly left in cafeteria,accessory,cafeteria,found
92,earbuds,earbuds possibly left in playground,electronics,playground,lost
93,umbrella,umbrella located in library area,accessory,library,found
94,charger,green colored charger near playground,electronics,playground,found
95,headphones,grey plastic headphones slightly damaged near canteen,electronics,canteen,found
96,phone,grey colored phone near computer lab,phone,computer lab,found
97,id card,id card of purple color found in cafeteria,document,cafeteria,lost
98,glasses,lost green glasses close to corridor,accessory,corridor,found
99,watch,black metal watch with scratches near playground,accessory,playground,lost
100,notebook,fabric notebook with logo around canteen,stationery,canteen,lost
101,keys,green metal keys in good condition near auditorium,accessory,auditorium,lost
102,wallet,wallet of brown color found in canteen,wallet,canteen,found
103,keys,fabric keys with stickers around auditorium,accessory,auditorium,found
104,calculator,calculator possibly left in canteen,electronics,canteen,lost
105,keys,grey keys spotted at playground,accessory,playground,found
106,laptop,laptop of grey color found in library,electronics,library,found
107,notebook,grey colored notebook near playground,stationery,playground,found
108,glasses,leather glasses with logo around computer lab,accessory,computer lab,found
109,charger,blue colored charger near corridor,electronics,corridor,found
110,notebook,lost silver notebook close to corridor,stationery,corridor,lost
111,handbag,blue colored handbag near classroom,bag,classroom,lost
112,handbag,blue rubber handbag seen around classroom,bag,classroom,lost
113,umbrella,umbrella located in library area,accessory,library,lost
114,umbrella,black umbrella spotted at auditorium,accessory,auditorium,lost
115,keys,keys possibly left in canteen,accessory,canteen,found
116,wallet,red wallet spotted at parking area,wallet,parking area,lost
117,id card,purple id card spotted at bus stop,document,bus stop,found
118,backpack,fabric backpack with logo around classroom,bag,classroom,lost
119,id card,id card of purple color found in playground,document,playground,lost
120,water bottle,brown metal water bottle in good condition near bus stop,accessory,bus stop,found
121,handbag,silver colored handbag near bus stop,bag,bus stop,lost
122,textbook,blue leather textbook slightly damaged near cafeteria,book,cafeteria,found
123,notebook,green leather notebook seen around cafeteria,stationery,cafeteria,lost
124,laptop,found laptop with slightly damaged in playground,electronics,playground,found
125,wallet,wallet of black color found in computer lab,wallet,computer lab,found
126,glasses,glasses possibly left in classroom,accessory,classroom,lost
127,glasses,glasses located in cafeteria area,accessory,cafeteria,lost
128,id card,lost purple id card close to parking area,document,parking area,lost
129,id card,plastic id card with zipper around bus stop,document,bus stop,lost
130,wallet,lost grey wallet close to corridor,wallet,corridor,found
131,notebook,notebook possibly left in auditorium,stationery,auditorium,lost
132,power bank,power bank of white color found in canteen,electronics,canteen,found
133,pen drive,white colored pen drive near corridor,electronics,corridor,found
134,pen drive,pen drive located in auditorium area,electronics,auditorium,found
135,backpack,plastic backpack slightly damaged around parking area,bag,parking area,lost
136,charger,lost silver charger close to corridor,electronics,corridor,found
137,calculator,purple plastic calculator in good condition near computer lab,electronics,computer lab,found
138,calculator,calculator possibly left in auditorium,electronics,auditorium,lost
139,textbook,grey leather textbook in good condition near computer lab,book,computer lab,found
140,charger,black rubber charger seen around parking area,electronics,parking area,found
141,wallet,wallet located in cafeteria area,wallet,cafeteria,lost
142,pen drive,red colored pen drive near library,electronics,library,found
143,pen drive,found pen drive with with logo in canteen,electronics,canteen,found
144,backpack,found backpack with with zipper in classroom,bag,classroom,lost
145,pen drive,green leather pen drive with name written near classroom,electronics,classroom,found
146,power bank,power bank possibly left in library,electronics,library,found
147,tablet,tablet possibly left in playground,electronics,playground,lost
148,umbrella,white rubber umbrella with zipper near corridor,accessory,corridor,lost
149,charger,black metal charger with logo near classroom,electronics,classroom,found
150,tablet,fabric tablet with zipper around playground,electronics,playground,found
151,backpack,backpack of brown color found in library,bag,library,found
152,umbrella,green leather umbrella with stickers near corridor,accessory,corridor,found
153,phone,purple phone spotted at canteen,phone,canteen,lost
154,watch,yellow leather watch seen around computer lab,accessory,computer lab,found
155,laptop,laptop located in playground area,electronics,playground,lost
156,water bottle,green water bottle spotted at classroom,accessory,classroom,found
157,id card,fabric id card with stickers around parking area,document,parking area,lost
158,id card,yellow rubber id card with stickers near library,document,library,found
159,watch,lost silver watch close to corridor,accessory,corridor,found
160,earbuds,earbuds possibly left in bus stop,electronics,bus stop,found
161,laptop,laptop possibly left in library,electronics,library,found
162,backpack,fabric backpack slightly damaged around library,bag,library,lost
163,watch,silver rubber watch seen around library,accessory,library,lost
164,tablet,lost silver tablet close to cafeteria,electronics,cafeteria,found
165,wallet,wallet possibly left in playground,wallet,playground,lost
166,water bottle,found water bottle with with zipper in classroom,accessory,classroom,lost
167,backpack,red fabric backpack seen around corridor,bag,corridor,lost
168,earbuds,lost white earbuds close to library,electronics,library,lost
169,keys,keys of silver color found in classroom,accessory,classroom,lost
170,textbook,found textbook with with two pockets in parking area,book,parking area,found
171,earbuds,grey rubber earbuds seen around auditorium,electronics,auditorium,found
172,pen drive,pen drive of silver color found in cafeteria,electronics,cafeteria,found
173,calculator,green calculator spotted at canteen,electronics,canteen,found
174,wallet,leather wallet slightly damaged around playground,wallet,playground,found
175,earbuds,lost blue earbuds close to auditorium,electronics,auditorium,lost
176,notebook,lost silver notebook close to auditorium,stationery,auditorium,lost
177,notebook,black colored notebook near auditorium,stationery,auditorium,lost
178,laptop,laptop of yellow color found in cafeteria,electronics,cafeteria,found
179,backpack,backpack located in computer lab area,bag,computer lab,lost
180,earbuds,earbuds of brown color found in canteen,electronics,canteen,found
181,id card,id card located in library area,document,library,found
182,power bank,power bank of black color found in bus stop,electronics,bus stop,found
183,textbook,textbook located in cafeteria area,book,cafeteria,lost
184,headphones,brown plastic headphones seen around corridor,electronics,corridor,found
185,handbag,blue colored handbag near auditorium,bag,auditorium,found
186,headphones,lost purple headphones close to parking area,electronics,parking area,lost
187,handbag,green fabric handbag seen around auditorium,bag,auditorium,lost
188,power bank,found power bank with with name written in parking area,electronics,parking area,found
189,id card,lost brown id card close to canteen,document,canteen,lost
190,backpack,lost silver backpack close to computer lab,bag,computer lab,found
191,backpack,silver plastic backpack seen around cafeteria,bag,cafeteria,found
192,pen drive,lost purple pen drive close to parking area,electronics,parking area,found
193,umbrella,umbrella of grey color found in computer lab,accessory,computer lab,lost
194,keys,keys located in library area,accessory,library,lost
195,textbook,textbook located in playground area,book,playground,lost
196,phone,phone located in computer lab area,phone,computer lab,lost
197,pen drive,found pen drive with with two pockets in corridor,electronics,corridor,lost
198,glasses,silver glasses spotted at parking area,accessory,parking area,lost
199,backpack,lost grey backpack close to bus stop,bag,bus stop,lost
200,earbuds,leather earbuds with stickers around bus stop,electronics,bus stop,lost
201,power bank,red power bank spotted at bus stop,electronics,bus stop,found
202,charger,black colored charger near classroom,electronics,classroom,found
203,textbook,blue colored textbook near auditorium,book,auditorium,lost
204,backpack,purple rubber backpack seen around computer lab,bag,computer lab,found
205,power bank,lost yellow power bank close to bus stop,electronics,bus stop,lost
206,earbuds,silver rubber earbuds with name written near auditorium,electronics,auditorium,found
207,headphones,headphones of black color found in bus stop,electronics,bus stop,lost
208,calculator,calculator of purple color found in canteen,electronics,canteen,lost
209,charger,silver plastic charger with stickers near computer lab,electronics,computer lab,lost
210,charger,lost silver charger close to parking area,electronics,parking area,found
211,phone,silver phone spotted at bus stop,phone,bus stop,lost
212,earbuds,earbuds located in auditorium area,electronics,auditorium,found
213,phone,red phone spotted at cafeteria,phone,cafeteria,found
214,textbook,red leather textbook seen around classroom,book,classroom,lost
215,id card,plastic id card with scratches around auditorium,document,auditorium,found
216,pen drive,brown pen drive spotted at playground,electronics,playground,lost
217,umbrella,brown rubber umbrella in good condition near auditorium,accessory,auditorium,found
218,laptop,found laptop with with scratches in playground,electronics,playground,found
219,laptop,found laptop with with logo in playground,electronics,playground,lost
220,earbuds,red earbuds spotted at parking area,electronics,parking area,found
221,keys,keys possibly left in corridor,accessory,corridor,lost
222,backpack,fabric backpack with logo around computer lab,bag,computer lab,found
223,charger,charger possibly left in auditorium,electronics,auditorium,found
224,handbag,fabric handbag with stickers around classroom,bag,classroom,lost
225,tablet,tablet of blue color found in playground,electronics,playground,lost
226,earbuds,earbuds located in classroom area,electronics,classroom,lost
227,handbag,plastic handbag slightly damaged around classroom,bag,classroom,found
228,id card,found id card with with name written in cafeteria,document,cafeteria,lost
229,textbook,blue colored textbook near cafeteria,book,cafeteria,lost
230,pen drive,blue metal pen drive with logo near auditorium,electronics,auditorium,lost
231,water bottle,water bottle possibly left in bus stop,accessory,bus stop,found
232,keys,found keys with with name written in parking area,accessory,parking area,found
233,charger,charger located in bus stop area,electronics,bus stop,found
234,keys,black plastic keys seen around canteen,accessory,canteen,lost
235,water bottle,water bottle located in classroom area,accessory,classroom,lost
236,tablet,white fabric tablet with two pockets near bus stop,electronics,bus stop,lost
237,water bottle,water bottle possibly left in playground,accessory,playground,lost
238,water bottle,found water bottle with with name written in bus stop,accessory,bus stop,found
239,charger,charger of green color found in library,electronics,library,found
240,water bottle,water bottle possibly left in corridor,accessory,corridor,lost
241,calculator,rubber calculator slightly damaged around cafeteria,electronics,cafeteria,lost
242,backpack,blue colored backpack near parking area,bag,parking area,found
243,wallet,wallet possibly left in auditorium,wallet,auditorium,lost
244,laptop,laptop possibly left in corridor,electronics,corridor,found
245,umbrella,umbrella located in auditorium area,accessory,auditorium,found
246,calculator,calculator possibly left in computer lab,electronics,computer lab,lost
247,keys,yellow colored keys near corridor,accessory,corridor,lost
248,calculator,calculator possibly left in library,electronics,library,found
249,glasses,glasses of grey color found in parking area,accessory,parking area,lost
250,wallet,leather wallet with zipper around canteen,wallet,canteen,lost
251,pen drive,found pen drive with with two pockets in cafeteria,electronics,cafeteria,lost
252,power bank,blue power bank spotted at canteen,electronics,canteen,found
253,calculator,plastic calculator with stickers around library,electronics,library,found
254,wallet,rubber wallet slightly damaged around playground,wallet,playground,lost
255,pen drive,pen drive of silver color found in cafeteria,electronics,cafeteria,lost
256,umbrella,white leather umbrella with name written near auditorium,accessory,auditorium,lost
257,pen drive,pen drive possibly left in classroom,electronics,classroom,found
258,pen drive,pen drive of green color found in computer lab,electronics,computer lab,lost
259,backpack,purple colored backpack near classroom,bag,classroom,lost
260,calculator,calculator located in computer lab area,electronics,computer lab,lost
261,power bank,power bank possibly left in cafeteria,electronics,cafeteria,found
262,notebook,leather notebook with scratches around playground,stationery,playground,found
263,textbook,blue colored textbook near classroom,book,classroom,lost
264,watch,green plastic watch with scratches near classroom,accessory,classroom,found
265,watch,watch located in canteen area,accessory,canteen,found
266,pen drive,purple pen drive spotted at bus stop,electronics,bus stop,found
267,power bank,power bank located in classroom area,electronics,classroom,found
268,calculator,red colored calculator near parking area,electronics,parking area,lost
269,phone,found phone with in good condition in playground,phone,playground,lost
270,laptop,laptop located in canteen area,electronics,canteen,found
271,wallet,wallet of purple color found in cafeteria,wallet,cafeteria,lost
272,handbag,found handbag with slightly damaged in library,bag,library,lost
273,tablet,tablet of grey color found in classroom,electronics,classroom,found
274,keys,yellow leather keys seen around library,accessory,library,lost
275,tablet,found tablet with with logo in corridor,electronics,corridor,lost
276,backpack,backpack possibly left in auditorium,bag,auditorium,lost
277,keys,grey colored keys near parking area,accessory,parking area,found
278,id card,yellow rubber id card seen around library,document,library,lost
279,laptop,found laptop with slightly damaged in parking area,electronics,parking area,found
280,laptop,found laptop with with scratches in auditorium,electronics,auditorium,found
281,id card,black colored id card near cafeteria,document,cafeteria,lost
282,headphones,lost white headphones close to computer lab,electronics,computer lab,lost
283,backpack,found backpack with slightly damaged in parking area,bag,parking area,found
284,phone,blue plastic phone seen around auditorium,phone,auditorium,found
285,laptop,white colored laptop near bus stop,electronics,bus stop,found
286,phone,grey plastic phone with two pockets near computer lab,phone,computer lab,found
287,watch,grey watch spotted at playground,accessory,playground,found
288,wallet,silver leather wallet slightly damaged near bus stop,wallet,bus stop,lost
289,keys,lost white keys close to computer lab,accessory,computer lab,found
290,phone,phone located in library area,phone,library,found
291,glasses,red leather glasses with scratches near library,accessory,library,lost
292,id card,id card possibly left in auditorium,document,auditorium,lost
293,pen drive,green plastic pen drive with logo near cafeteria,electronics,cafeteria,found
294,earbuds,lost yellow earbuds close to corridor,electronics,corridor,lost
295,water bottle,found water bottle with in good condition in corridor,accessory,corridor,found
296,tablet,fabric tablet slightly damaged around auditorium,electronics,auditorium,found
297,glasses,glasses of silver color found in computer lab,accessory,computer lab,found
298,tablet,white tablet spotted at auditorium,electronics,auditorium,lost
299,calculator,grey colored calculator near computer lab,electronics,computer lab,lost
300,water bottle,green plastic water bottle seen around classroom,accessory,classroom,lost
301,tablet,tablet possibly left in auditorium,electronics,auditorium,lost
302,keys,black leather keys seen around bus stop,accessory,bus stop,lost
303,id card,lost grey id card close to library,document,library,found
304,charger,grey metal charger slightly damaged near cafeteria,electronics,cafeteria,lost
305,id card,purple leather id card seen around auditorium,document,auditorium,found
306,calculator,white metal calculator slightly damaged near canteen,electronics,canteen,found
307,keys,blue metal keys slightly damaged near cafeteria,accessory,cafeteria,found
308,id card,id card of black color found in parking area,document,parking area,lost
309,headphones,red colored headphones near canteen,electronics,canteen,lost
310,charger,charger possibly left in cafeteria,electronics,cafeteria,found
311,handbag,black fabric handbag seen around playground,bag,playground,found
312,pen drive,found pen drive with with logo in bus stop,electronics,bus stop,lost
313,calculator,found calculator with with two pockets in canteen,electronics,canteen,lost
314,wallet,green plastic wallet seen around cafeteria,wallet,cafeteria,found
315,notebook,notebook located in parking area area,stationery,parking area,found
316,handbag,handbag of green color found in computer lab,bag,computer lab,lost
317,headphones,headphones possibly left in canteen,electronics,canteen,lost
318,water bottle,water bottle located in computer lab area,accessory,computer lab,found
319,keys,found keys with with zipper in playground,accessory,playground,found
320,pen drive,lost grey pen drive close to canteen,electronics,canteen,lost
321,umbrella,lost brown umbrella close to classroom,accessory,classroom,found
322,id card,green metal id card seen around library,document,library,lost
323,backpack,silver rubber backpack with scratches near cafeteria,bag,cafeteria,found
324,wallet,purple wallet spotted at canteen,wallet,canteen,lost
325,charger,charger of purple color found in corridor,electronics,corridor,found
326,umbrella,lost black umbrella close to bus stop,accessory,bus stop,lost
327,earbuds,earbuds of red color found in parking area,electronics,parking area,found
328,tablet,tablet of purple color found in auditorium,electronics,auditorium,found
