item_id,item_name,description,category,location,status
658,earbuds,lost grey earbuds close to computer lab,electronics,computer lab,found
659,keys,lost black keys close to classroom,accessory,classroom,found
660,umbrella,umbrella possibly left in computer lab,accessory,computer lab,found
661,umbrella,umbrella possibly left in parking area,accessory,parking area,found
662,phone,green fabric phone slightly damaged near corridor,phone,corridor,found
663,id card,brown id card spotted at computer lab,document,computer lab,found
664,water bottle,water bottle located in auditorium area,accessory,auditorium,lost
665,power bank,leather power bank in good condition around bus stop,electronics,bus stop,lost
666,pen drive,pen drive possibly left in parking area,electronics,parking area,found
667,charger,brown fabric charger seen around corridor,electronics,corridor,lost
668,calculator,lost silver calculator close to canteen,electronics,canteen,found
669,laptop,brown fabric laptop in good condition near playground,electronics,playground,lost
670,laptop,purple fabric laptop seen around canteen,electronics,canteen,found
671,laptop,laptop of white color found in library,electronics,library,found
672,handbag,handbag located in computer lab area,bag,computer lab,lost
673,headphones,rubber headphones with zipper around classroom,electronics,classroom,found
674,watch,rubber watch in good condition around corridor,accessory,corridor,found
675,handbag,blue handbag spotted at classroom,bag,classroom,found
676,id card,blue metal id card seen around classroom,document,classroom,lost
677,watch,grey plastic watch seen around parking area,accessory,parking area,lost
678,charger,lost brown charger close to playground,electronics,playground,lost
679,water bottle,yellow colored water bottle near corridor,accessory,corridor,lost
680,power bank,power bank of yellow color found in library,electronics,library,lost
681,watch,found watch with in good condition in computer lab,accessory,computer lab,found
682,water bottle,water bottle possibly left in playground,accessory,playground,lost
683,handbag,handbag located in auditorium area,bag,auditorium,found
684,umbrella,fabric umbrella with two pockets around computer lab,accessory,computer lab,found
685,headphones,green rubber headphones seen around auditorium,electronics,auditorium,lost
686,backpack,backpack of green color found in canteen,bag,canteen,lost
687,earbuds,fabric earbuds with two pockets around cafeteria,electronics,cafeteria,found
688,earbuds,found earbuds with in good condition in classroom,electronics,classroom,found
689,power bank,power bank possibly left in classroom,electronics,classroom,found
690,watch,found watch with with name written in cafeteria,accessory,cafeteria,found
691,calculator,found calculator with with zipper in corridor,electronics,corridor,found
692,backpack,backpack of white color found in bus stop,bag,bus stop,found
693,backpack,black colored backpack near corridor,bag,corridor,found
694,water bottle,lost red water bottle close to playground,accessory,playground,lost
695,tablet,purple tablet spotted at parking area,electronics,parking area,found
696,phone,rubber phone with scratches around computer lab,phone,computer lab,lost
697,calculator,red plastic calculator seen around corridor,electronics,corridor,found
698,calculator,calculator possibly left in canteen,electronics,canteen,lost
699,textbook,textbook possibly left in corridor,book,corridor,found
700,glasses,found glasses with in good condition in library,accessory,library,lost
701,calculator,yellow leather calculator seen around library,electronics,library,lost
702,tablet,grey colored tablet near parking area,electronics,parking area,lost
703,id card,brown id card spotted at computer lab,document,computer lab,found
704,watch,silver plastic watch slightly damaged near corridor,accessory,corridor,found
705,phone,phone located in library area,phone,library,found
706,textbook,textbook located in playground area,book,playground,found
707,umbrella,black umbrella spotted at auditorium,accessory,auditorium,lost
708,id card,id card possibly left in auditorium,document,auditorium,found
709,pen drive,grey pen drive spotted at computer lab,electronics,computer lab,found
710,wallet,found wallet with with stickers in canteen,wallet,canteen,lost
711,notebook,white colored notebook near parking area,stationery,parking area,found
712,watch,brown rubber watch with scratches near bus stop,accessory,bus stop,found
713,keys,silver fabric keys slightly damaged near library,accessory,library,lost
714,keys,keys located in classroom area,accessory,classroom,found
715,notebook,white fabric notebook in good condition near computer lab,stationery,computer lab,found
716,tablet,black plastic tablet seen around computer lab,electronics,computer lab,lost
717,phone,white metal phone seen around parking area,phone,parking area,lost
718,umbrella,umbrella located in corridor area,accessory,corridor,found
719,textbook,red textbook spotted at library,book,library,found
720,headphones,found headphones with with name written in library,electronics,library,found
721,handbag,rubber handbag with name written around canteen,bag,canteen,lost
722,watch,silver plastic watch seen around corridor,accessory,corridor,lost
723,backpack,red metal backpack with logo near cafeteria,bag,cafeteria,found
724,pen drive,pen drive possibly left in library,electronics,library,lost
725,glasses,glasses of green color found in cafeteria,accessory,cafeteria,lost
726,headphones,purple headphones spotted at parking area,electronics,parking area,found
727,water bottle,rubber water bottle with logo around playground,accessory,playground,lost
728,water bottle,yellow water bottle spotted at cafeteria,accessory,cafeteria,lost
729,textbook,grey rubber textbook seen around corridor,book,corridor,found
730,charger,white metal charger seen around computer lab,electronics,computer lab,found
731,laptop,laptop located in library area,electronics,library,found
732,handbag,blue fabric handbag seen around cafeteria,bag,cafeteria,lost
733,power bank,power bank possibly left in playground,electronics,playground,lost
734,headphones,headphones located in auditorium area,electronics,auditorium,lost
735,backpack,black colored backpack near corridor,bag,corridor,found
736,pen drive,yellow pen drive spotted at bus stop,electronics,bus stop,lost
737,notebook,notebook possibly left in computer lab,stationery,computer lab,found
738,power bank,purple plastic power bank seen around classroom,electronics,classroom,found
739,laptop,laptop located in computer lab area,electronics,computer lab,lost
740,laptop,found laptop with with two pockets in auditorium,electronics,auditorium,lost
741,watch,watch of yellow color found in bus stop,accessory,bus stop,lost
742,id card,id card located in playground area,document,playground,found
743,backpack,yellow colored backpack near library,bag,library,lost
744,phone,grey phone spotted at auditorium,phone,auditorium,found
745,id card,id card possibly left in parking area,document,parking area,lost
746,headphones,headphones possibly left in auditorium,electronics,auditorium,lost
747,backpack,found backpack with with name written in playground,bag,playground,lost
748,power bank,power bank located in auditorium area,electronics,auditorium,lost
749,earbuds,silver metal earbuds with name written near cafeteria,electronics,cafeteria,lost
750,calculator,blue leather calculator seen around cafeteria,electronics,cafeteria,lost
751,handbag,handbag of grey color found in library,bag,library,found
752,water bottle,water bottle possibly left in library,accessory,library,lost
753,handbag,silver leather handbag with name written near library,bag,library,lost
754,power bank,metal power bank with logo around classroom,electronics,classroom,found
755,headphones,blue headphones spotted at parking area,electronics,parking area,lost
756,charger,charger located in classroom area,electronics,classroom,lost
757,handbag,white rubber handbag seen around parking area,bag,parking area,lost
758,calculator,blue colored calculator near parking area,electronics,parking area,found
759,notebook,purple metal notebook slightly damaged near playground,stationery,playground,found
760,umbrella,purple umbrella spotted at playground,accessory,playground,found
761,id card,green colored id card near bus stop,document,bus stop,found
762,earbuds,lost green earbuds close to parking area,electronics,parking area,lost
763,laptop,silver laptop spotted at canteen,electronics,canteen,lost
764,handbag,plastic handbag in good condition around corridor,bag,corridor,found
765,water bottle,red rubber water bottle with stickers near computer lab,accessory,computer lab,found
766,umbrella,umbrella possibly left in canteen,accessory,canteen,lost
767,charger,leather charger with zipper around bus stop,electronics,bus stop,found
768,id card,purple id card spotted at parking area,document,parking area,lost
769,backpack,yellow colored backpack near library,bag,library,found
770,calculator,black plastic calculator with zipper near auditorium,electronics,auditorium,found
771,notebook,white colored notebook near auditorium,stationery,auditorium,found
772,power bank,power bank of silver color found in auditorium,electronics,auditorium,lost
773,backpack,lost brown backpack close to computer lab,bag,computer lab,lost
774,laptop,plastic laptop in good condition around cafeteria,electronics,cafeteria,lost
775,wallet,plastic wallet with logo around canteen,wallet,canteen,found
776,earbuds,lost brown earbuds close to computer lab,electronics,computer lab,lost
777,charger,blue plastic charger with scratches near parking area,electronics,parking area,found
778,notebook,lost brown notebook close to bus stop,stationery,bus stop,found
779,pen drive,lost green pen drive close to parking area,electronics,parking area,lost
780,water bottle,grey metal water bottle seen around canteen,accessory,canteen,found
781,tablet,tablet of grey color found in corridor,electronics,corridor,found
782,backpack,grey rubber backpack seen around classroom,bag,classroom,lost
783,wallet,wallet of brown color found in playground,wallet,playground,found
784,glasses,lost green glasses close to computer lab,accessory,computer lab,found
785,notebook,notebook possibly left in canteen,stationery,canteen,lost
786,headphones,headphones possibly left in auditorium,electronics,auditorium,found
787,keys,keys located in bus stop area,accessory,bus stop,found
788,textbook,white colored textbook near library,book,library,found
789,water bottle,red water bottle spotted at computer lab,accessory,computer lab,lost
790,watch,watch located in library area,accessory,library,found
791,earbuds,leather earbuds with scratches around auditorium,electronics,auditorium,lost
792,earbuds,silver fabric earbuds with logo near parking area,electronics,parking area,found
793,umbrella,umbrella located in auditorium area,accessory,auditorium,found
794,backpack,backpack possibly left in library,bag,library,found
795,pen drive,black rubber pen drive seen around parking area,electronics,parking area,found
796,phone,red phone spotted at playground,phone,playground,found
797,id card,id card of green color found in bus stop,document,bus stop,lost
798,earbuds,silver earbuds spotted at library,electronics,library,found
799,phone,phone located in canteen area,phone,canteen,lost
800,tablet,black tablet spotted at canteen,electronics,canteen,lost
801,water bottle,silver metal water bottle with name written near auditorium,accessory,auditorium,lost
802,phone,phone located in parking area area,phone,parking area,lost
803,id card,lost blue id card close to library,document,library,lost
804,wallet,grey colored wallet near parking area,wallet,parking area,found
805,umbrella,lost yellow umbrella close to corridor,accessory,corridor,lost
806,umbrella,fabric umbrella with zipper around parking area,accessory,parking area,found
807,umbrella,umbrella of green color found in playground,accessory,playground,found
808,calculator,calculator located in auditorium area,electronics,auditorium,lost
809,handbag,handbag of purple color found in library,bag,library,lost
810,headphones,purple rubber headphones seen around auditorium,electronics,auditorium,lost
811,notebook,fabric notebook with logo around auditorium,stationery,auditorium,lost
812,calculator,red colored calculator near cafeteria,electronics,cafeteria,lost
813,id card,lost brown id card close to classroom,document,classroom,lost
814,phone,brown metal phone with logo near auditorium,phone,auditorium,lost
815,pen drive,found pen drive with with name written in auditorium,electronics,auditorium,lost
816,water bottle,brown colored water bottle near corridor,accessory,corridor,found
817,earbuds,earbuds located in library area,electronics,library,found
818,laptop,laptop possibly left in computer lab,electronics,computer lab,lost
819,backpack,backpack located in auditorium area,bag,auditorium,found
820,glasses,purple colored glasses near classroom,accessory,classroom,lost
821,power bank,lost brown power bank close to bus stop,electronics,bus stop,lost
822,pen drive,red colored pen drive near canteen,electronics,canteen,found
823,water bottle,fabric water bottle with stickers around classroom,accessory,classroom,found
824,glasses,lost black glasses close to classroom,accessory,classroom,found
825,textbook,leather textbook in good condition around parking area,book,parking area,lost
826,wallet,metal wallet with stickers around library,wallet,library,lost
827,watch,grey watch spotted at library,accessory,library,found
828,water bottle,lost yellow water bottle close to parking area,accessory,parking area,lost
829,pen drive,pen drive possibly left in classroom,electronics,classroom,lost
830,id card,id card of brown color found in bus stop,document,bus stop,lost
831,phone,phone possibly left in library,phone,library,lost
832,backpack,backpack of red color found in library,bag,library,found
833,umbrella,umbrella possibly left in bus stop,accessory,bus stop,found
834,charger,charger located in classroom area,electronics,classroom,found
835,charger,blue fabric charger seen around corridor,electronics,corridor,found
836,charger,blue charger spotted at auditorium,electronics,auditorium,found
837,power bank,black power bank spotted at library,electronics,library,lost
838,glasses,glasses of grey color found in playground,accessory,playground,found
839,calculator,fabric calculator with logo around parking area,electronics,parking area,lost
840,handbag,yellow colored handbag near canteen,bag,canteen,found
841,power bank,lost white power bank close to canteen,electronics,canteen,found
842,pen drive,green leather pen drive seen around parking area,electronics,parking area,found
843,watch,plastic watch with zipper around cafeteria,accessory,cafeteria,found
844,keys,leather keys with two pockets around auditorium,accessory,auditorium,lost
845,earbuds,earbuds possibly left in classroom,electronics,classroom,lost
846,wallet,wallet possibly left in corridor,wallet,corridor,lost
847,watch,watch located in computer lab area,accessory,computer lab,found
848,textbook,textbook located in library area,book,library,found
849,glasses,silver fabric glasses with logo near parking area,accessory,parking area,found
850,handbag,green colored handbag near corridor,bag,corridor,lost
851,keys,keys possibly left in parking area,accessory,parking area,found
852,pen drive,pen drive of blue color found in parking area,electronics,parking area,lost
853,glasses,grey glasses spotted at computer lab,accessory,computer lab,lost
854,keys,silver fabric keys slightly damaged near corridor,accessory,corridor,lost
855,earbuds,red earbuds spotted at corridor,electronics,corridor,lost
856,laptop,fabric laptop with stickers around playground,electronics,playground,found
857,id card,id card possibly left in computer lab,document,computer lab,lost
858,water bottle,lost red water bottle close to playground,accessory,playground,lost
859,backpack,white backpack spotted at auditorium,bag,auditorium,found
860,notebook,grey rubber notebook seen around parking area,stationery,parking area,lost
861,id card,metal id card slightly damaged around library,document,library,lost
862,watch,plastic watch with name written around canteen,accessory,canteen,lost
863,power bank,silver plastic power bank seen around library,electronics,library,found
864,earbuds,grey rubber earbuds with scratches near bus stop,electronics,bus stop,found
865,headphones,lost green headphones close to corridor,electronics,corridor,lost
866,keys,keys possibly left in canteen,accessory,canteen,found
867,phone,grey leather phone with zipper near playground,phone,playground,lost
868,tablet,tablet possibly left in classroom,electronics,classroom,found
869,earbuds,red earbuds spotted at cafeteria,electronics,cafeteria,found
870,keys,fabric keys with zipper around canteen,accessory,canteen,lost
871,notebook,leather notebook with two pockets around canteen,stationery,canteen,found
872,backpack,lost brown backpack close to corridor,bag,corridor,found
873,notebook,purple plastic notebook seen around corridor,stationery,corridor,found
874,charger,blue metal charger with logo near playground,electronics,playground,found
875,keys,red keys spotted at library,accessory,library,found
876,laptop,laptop of red color found in computer lab,electronics,computer lab,lost
877,tablet,black rubber tablet seen around playground,electronics,playground,lost
878,headphones,headphones located in computer lab area,electronics,computer lab,lost
879,phone,phone of red color found in library,phone,library,lost
880,calculator,calculator possibly left in cafeteria,electronics,cafeteria,found
881,laptop,yellow colored laptop near playground,electronics,playground,lost
882,calculator,green rubber calculator slightly damaged near library,electronics,library,found
883,notebook,notebook possibly left in corridor,stationery,corridor,found
884,wallet,wallet of black color found in classroom,wallet,classroom,found
885,watch,watch possibly left in parking area,accessory,parking area,found
886,watch,watch located in auditorium area,accessory,auditorium,lost
887,id card,green metal id card with two pockets near playground,document,playground,found
888,handbag,found handbag with with zipper in classroom,bag,classroom,lost
889,earbuds,grey earbuds spotted at corridor,electronics,corridor,found
890,pen drive,fabric pen drive with scratches around classroom,electronics,classroom,lost
891,power bank,power bank possibly left in classroom,electronics,classroom,found
892,water bottle,black fabric water bottle in good condition near bus stop,accessory,bus stop,found
893,pen drive,pen drive located in corridor area,electronics,corridor,found
894,charger,yellow charger spotted at computer lab,electronics,computer lab,lost
895,keys,keys of blue color found in auditorium,accessory,auditorium,found
896,charger,purple colored charger near auditorium,electronics,auditorium,lost
897,watch,watch located in auditorium area,accessory,auditorium,found
898,umbrella,umbrella possibly left in parking area,accessory,parking area,found
899,water bottle,blue colored water bottle near parking area,accessory,parking area,found
900,id card,rubber id card with zipper around canteen,document,canteen,lost
901,earbuds,yellow plastic earbuds in good condition near auditorium,electronics,auditorium,lost
902,wallet,lost blue wallet close to playground,wallet,playground,lost
903,earbuds,earbuds located in parking area area,electronics,parking area,found
904,pen drive,lost white pen drive close to classroom,electronics,classroom,lost
905,tablet,white tablet spotted at cafeteria,electronics,cafeteria,found
906,glasses,found glasses with with scratches in canteen,accessory,canteen,lost
907,umbrella,white umbrella spotted at classroom,accessory,classroom,found
908,power bank,white metal power bank with name written near computer lab,electronics,computer lab,found
909,calculator,green calculator spotted at auditorium,electronics,auditorium,lost
910,watch,lost red watch close to library,accessory,library,lost
911,notebook,white notebook spotted at canteen,stationery,canteen,found
912,earbuds,black metal earbuds with zipper near corridor,electronics,corridor,lost
913,backpack,backpack located in parking area area,bag,parking area,found
914,handbag,handbag located in parking area area,bag,parking area,found
915,calculator,calculator possibly left in classroom,electronics,classroom,found
916,laptop,brown leather laptop seen around cafeteria,electronics,cafeteria,found
917,glasses,purple glasses spotted at computer lab,accessory,computer lab,found
918,calculator,found calculator with with scratches in computer lab,electronics,computer lab,lost
919,charger,lost white charger close to computer lab,electronics,computer lab,lost
920,backpack,backpack possibly left in library,bag,library,found
921,backpack,backpack located in parking area area,bag,parking area,lost
922,laptop,laptop of brown color found in canteen,electronics,canteen,found
923,laptop,laptop located in canteen area,electronics,canteen,found
924,water bottle,water bottle located in canteen area,accessory,canteen,lost
925,power bank,blue colored power bank near bus stop,electronics,bus stop,found
926,watch,silver watch spotted at playground,accessory,playground,lost
927,watch,brown colored watch near bus stop,accessory,bus stop,lost
928,charger,yellow colored charger near computer lab,electronics,computer lab,lost
929,keys,keys of silver color found in bus stop,accessory,bus stop,found
930,backpack,white backpack spotted at parking area,bag,parking area,found
931,charger,yellow leather charger in good condition near playground,electronics,playground,found
932,calculator,lost red calculator close to computer lab,electronics,computer lab,found
933,laptop,laptop possibly left in classroom,electronics,classroom,lost
934,power bank,lost blue power bank close to bus stop,electronics,bus stop,lost
935,umbrella,green colored umbrella near computer lab,accessory,computer lab,lost
936,umbrella,umbrella possibly left in computer lab,accessory,computer lab,lost
937,tablet,tablet of purple color found in playground,electronics,playground,found
938,water bottle,blue leather water bottle with stickers near computer lab,accessory,computer lab,lost
939,pen drive,lost white pen drive close to bus stop,electronics,bus stop,lost
940,laptop,laptop located in computer lab area,electronics,computer lab,found
941,handbag,lost grey handbag close to cafeteria,bag,cafeteria,lost
942,umbrella,black rubber umbrella with two pockets near classroom,accessory,classroom,lost
943,headphones,headphones possibly left in parking area,electronics,parking area,found
944,pen drive,pen drive possibly left in auditorium,electronics,auditorium,found
945,keys,green metal keys seen around auditorium,accessory,auditorium,lost
946,power bank,lost yellow power bank close to classroom,electronics,classroom,found
947,calculator,calculator located in cafeteria area,electronics,cafeteria,found
948,backpack,green backpack spotted at parking area,bag,parking area,lost
949,backpack,found backpack with with zipper in bus stop,bag,bus stop,lost
950,charger,charger of black color found in computer lab,electronics,computer lab,lost
951,power bank,metal power bank with name written around corridor,electronics,corridor,lost
952,id card,lost yellow id card close to computer lab,document,computer lab,found
953,handbag,found handbag with with zipper in auditorium,bag,auditorium,lost
954,textbook,textbook of grey color found in parking area,book,parking area,found
955,glasses,glasses of green color found in corridor,accessory,corridor,found
956,power bank,black fabric power bank with stickers near canteen,electronics,canteen,found
957,wallet,white fabric wallet seen around cafeteria,wallet,cafeteria,found
958,earbuds,lost yellow earbuds close to computer lab,electronics,computer lab,lost
959,calculator,plastic calculator in good condition around classroom,electronics,classroom,found
960,tablet,tablet possibly left in parking area,electronics,parking area,found
961,headphones,blue colored headphones near library,electronics,library,lost
962,id card,white id card spotted at computer lab,document,computer lab,lost
963,pen drive,pen drive located in bus stop area,electronics,bus stop,lost
964,charger,charger located in classroom area,electronics,classroom,lost
965,handbag,white handbag spotted at classroom,bag,classroom,found
966,notebook,fabric notebook with stickers around canteen,stationery,canteen,found
967,power bank,lost brown power bank close to library,electronics,library,lost
968,umbrella,found umbrella with with logo in auditorium,accessory,auditorium,found
969,glasses,glasses possibly left in cafeteria,accessory,cafeteria,found
970,headphones,headphones located in auditorium area,electronics,auditorium,lost
971,power bank,purple leather power bank in good condition near bus stop,electronics,bus stop,found
972,glasses,brown colored glasses near canteen,accessory,canteen,found
973,glasses,fabric glasses in good condition around classroom,accessory,classroom,lost
974,keys,grey colored keys near canteen,accessory,canteen,found
975,textbook,lost grey textbook close to parking area,book,parking area,found
976,handbag,brown handbag spotted at playground,bag,playground,found
977,charger,metal charger with logo around canteen,electronics,canteen,lost
978,earbuds,earbuds of white color found in classroom,electronics,classroom,lost
979,tablet,green colored tablet near corridor,electronics,corridor,lost
980,id card,red id card spotted at auditorium,document,auditorium,lost
981,headphones,found headphones with with name written in cafeteria,electronics,cafeteria,lost
982,charger,purple colored charger near computer lab,electronics,computer lab,lost
983,power bank,grey metal power bank seen around corridor,electronics,corridor,lost
